{
  "schema_version": 1,
  "generated_at": "2026-09-10T07:04:07.759119+00:00",
  "nodes": [
    {
      "id": "RES-FLOATING-POINT-SUMMATION",
      "title": "浮点求和的数值稳定性：顺序、补偿与抵消",
      "kind": "research",
      "path": "research/floating-point-summation/research.json",
      "fingerprint": "3aa767e5799496f7335c783cd091daa2364537cc073f9c7b5ac1d652f2202481",
      "keywords": [],
      "review": {},
      "risks": [],
      "execution_status": "active",
      "scope": null,
      "locator": "metadata",
      "owner": null,
      "record_reason": "",
      "statement": "",
      "missing": false,
      "level": null
    },
    {
      "id": "FILE-04ebc70eb8c5db21fecda8ef",
      "title": "浮点求和的数值稳定性：顺序、补偿与抵消",
      "kind": "research",
      "path": "research/floating-point-summation/research.json",
      "fingerprint": "239ab0fcd73db65fe6b72b3cd756cc876a83e0fd264ad5f00f4fced71664aea7",
      "keywords": [],
      "review": {},
      "risks": [],
      "execution_status": null,
      "scope": null,
      "locator": "",
      "owner": null,
      "record_reason": "",
      "statement": "",
      "missing": false,
      "level": null
    },
    {
      "id": "FILE-05e6b2da7190399b03745bb7",
      "title": "validate-invocation.json",
      "kind": "research",
      "path": "research/floating-point-summation/execution/validate-invocation.json",
      "fingerprint": "c750ae2918b96187d4e85f776c42ffd8b001211541de0f7b9d99f8dd6b6d1979",
      "keywords": [],
      "review": {},
      "risks": [],
      "execution_status": null,
      "scope": null,
      "locator": "",
      "owner": null,
      "record_reason": "",
      "statement": "",
      "missing": false,
      "level": null
    },
    {
      "id": "FILE-0d0651233a536d9a041713af",
      "title": "探索02：补偿求和的抵消反例",
      "kind": "research",
      "path": "research/floating-point-summation/rounds/02.md",
      "fingerprint": "aa187eda5996c703d54a3568c94aadaf1d4ff00f1998165ef4f1a0f00858699a",
      "keywords": [],
      "review": {},
      "risks": [],
      "execution_status": null,
      "scope": null,
      "locator": "",
      "owner": null,
      "record_reason": "",
      "statement": "",
      "missing": false,
      "level": null
    },
    {
      "id": "FILE-15641f4bad6fefcefa55aaca",
      "title": "round-02.md",
      "kind": "research",
      "path": "research/floating-point-summation/details/report-v2/round-02.md",
      "fingerprint": "70b04d20e8973083af0f7a99a27c8715d97791bf051fbbd1a5f8d3b3c410df0a",
      "keywords": [],
      "review": {},
      "risks": [],
      "execution_status": null,
      "scope": null,
      "locator": "",
      "owner": null,
      "record_reason": "",
      "statement": "",
      "missing": false,
      "level": "L1"
    },
    {
      "id": "FILE-1c1501175eea865ea17ac916",
      "title": "inspect-invocation.json",
      "kind": "research",
      "path": "research/floating-point-summation/execution/inspect-invocation.json",
      "fingerprint": "29cbb7b0c2646728f4797f979575039261513df0a5cdabd69219f487968cf2ad",
      "keywords": [],
      "review": {},
      "risks": [],
      "execution_status": null,
      "scope": null,
      "locator": "",
      "owner": null,
      "record_reason": "",
      "statement": "",
      "missing": false,
      "level": null
    },
    {
      "id": "FILE-1cfee46a8e211db0cde9f13c",
      "title": "03.json",
      "kind": "research",
      "path": "research/floating-point-summation/rounds/03.json",
      "fingerprint": "fb1494db6f27a64f4b9a5915c50afb5a5b68950e642be632f014685127ec46df",
      "keywords": [],
      "review": {},
      "risks": [],
      "execution_status": null,
      "scope": null,
      "locator": "",
      "owner": null,
      "record_reason": "",
      "statement": "",
      "missing": false,
      "level": null
    },
    {
      "id": "FILE-1da9e08b09297a1b0adc0673",
      "title": "证据台账",
      "kind": "research",
      "path": "research/floating-point-summation/EVIDENCE_LEDGER.md",
      "fingerprint": "c4b606f2aa71a94052310598d7c3b34309f9b0eb6720aebbff7a8aeb4652af9f",
      "keywords": [],
      "review": {},
      "risks": [],
      "execution_status": null,
      "scope": null,
      "locator": "",
      "owner": null,
      "record_reason": "",
      "statement": "",
      "missing": false,
      "level": null
    },
    {
      "id": "FILE-229b29c14475d895ac37cd20",
      "title": "experiment.py",
      "kind": "research",
      "path": "research/floating-point-summation/experiment.py",
      "fingerprint": "8dc8cd86e17a2595b0217e9bcef712c5a61db1eec07828fb446ea556657f2284",
      "keywords": [],
      "review": {},
      "risks": [],
      "execution_status": null,
      "scope": null,
      "locator": "",
      "owner": null,
      "record_reason": "",
      "statement": "",
      "missing": false,
      "level": null
    },
    {
      "id": "FILE-26a108cbbe324da84bad51d0",
      "title": "round-01.md",
      "kind": "research",
      "path": "research/floating-point-summation/details/report-v2/round-01.md",
      "fingerprint": "77941df3cdaf33546da7a65362918f07f00fd02196163e4992508444fe763d23",
      "keywords": [],
      "review": {},
      "risks": [],
      "execution_status": null,
      "scope": null,
      "locator": "",
      "owner": null,
      "record_reason": "",
      "statement": "",
      "missing": false,
      "level": "L1"
    },
    {
      "id": "FILE-28bad5f1b6cb9e3b87a25d38",
      "title": "memory-request.json",
      "kind": "research",
      "path": "research/floating-point-summation/execution/memory-request.json",
      "fingerprint": "44e4ec2cb490adc22838fe7ee92e84ded235a450c2750405cc0904ca332d01d3",
      "keywords": [],
      "review": {},
      "risks": [],
      "execution_status": null,
      "scope": null,
      "locator": "",
      "owner": null,
      "record_reason": "",
      "statement": "",
      "missing": false,
      "level": null
    },
    {
      "id": "FILE-2d0325f89b3212a87a030a54",
      "title": "restore-manifest.json",
      "kind": "research",
      "path": "research/floating-point-summation/fixtures/restore-manifest.json",
      "fingerprint": "9af46fea0e3115e21d8724a0fe4bcf96bde8fe2fd449b2ade333049f00e54592",
      "keywords": [],
      "review": {},
      "risks": [],
      "execution_status": null,
      "scope": null,
      "locator": "",
      "owner": null,
      "record_reason": "",
      "statement": "",
      "missing": false,
      "level": "L0"
    },
    {
      "id": "FILE-2fba5b348846eee2323257cd",
      "title": "探索01：相同数量的小量，为什么会因顺序不同而丢失？",
      "kind": "research",
      "path": "research/floating-point-summation/details/round-01.md",
      "fingerprint": "44d927fb0df18f2c3689a71bb621191d68cc0834d3c2473a68d88e5c8020881c",
      "keywords": [],
      "review": {},
      "risks": [],
      "execution_status": null,
      "scope": null,
      "locator": "",
      "owner": null,
      "record_reason": "",
      "statement": "",
      "missing": false,
      "level": null
    },
    {
      "id": "FILE-3daf4ef8c2f1fdc7299981ec",
      "title": "浮点求和：长期开发测试例子",
      "kind": "research",
      "path": "research/floating-point-summation/README.md",
      "fingerprint": "91619aeecb0507023ea0636d00c00f9bcd3b62f57b58fc8c9c8d8edb1c229d84",
      "keywords": [],
      "review": {},
      "risks": [],
      "execution_status": null,
      "scope": null,
      "locator": "",
      "owner": null,
      "record_reason": "",
      "statement": "",
      "missing": false,
      "level": null
    },
    {
      "id": "FILE-3fe84e8699b247240114198d",
      "title": "探索02：Kahan补偿为何仍会在三项抵消中失败？",
      "kind": "research",
      "path": "research/floating-point-summation/details/round-02.md",
      "fingerprint": "69e34ad869d3021635e1b47ffdcbc2c76c6c435f29dfa9c1ec84fb67d1376517",
      "keywords": [],
      "review": {},
      "risks": [],
      "execution_status": null,
      "scope": null,
      "locator": "",
      "owner": null,
      "record_reason": "",
      "statement": "",
      "missing": false,
      "level": null
    },
    {
      "id": "FILE-503521d61c519f375e2f5f39",
      "title": "01.json",
      "kind": "research",
      "path": "research/floating-point-summation/rounds/01.json",
      "fingerprint": "e86372aed71838770b55c2678a22033773da4d24aff67f8b8cade653d5bf2b0d",
      "keywords": [],
      "review": {},
      "risks": [],
      "execution_status": null,
      "scope": null,
      "locator": "",
      "owner": null,
      "record_reason": "",
      "statement": "",
      "missing": false,
      "level": null
    },
    {
      "id": "FILE-5f4c6af5be012fff4bd56f6f",
      "title": "round-03.md.snapshot",
      "kind": "research",
      "path": "research/floating-point-summation/fixtures/original-documents/details/round-03.md.snapshot",
      "fingerprint": "16afde15315ac4f45463c1f3124a3e7d886398e8c09c6fb9adfdc19e43bd228d",
      "keywords": [],
      "review": {},
      "risks": [],
      "execution_status": null,
      "scope": null,
      "locator": "",
      "owner": null,
      "record_reason": "",
      "statement": "",
      "missing": false,
      "level": "L1"
    },
    {
      "id": "FILE-603aaac3032729ecf29b3f19",
      "title": "探索01：大数与小增量的顺序影响",
      "kind": "research",
      "path": "research/floating-point-summation/rounds/01.md",
      "fingerprint": "f5d40bc38f41d9f6f64cd2068a59f40e7332eb6cc511b27d56df8715729c17fc",
      "keywords": [],
      "review": {},
      "risks": [],
      "execution_status": null,
      "scope": null,
      "locator": "",
      "owner": null,
      "record_reason": "",
      "statement": "",
      "missing": false,